{
  "kind": "intent",
  "intent_id": "I-2025-0001",
  "agent": {
    "actor_id": "agent-auth",
    "actor_type": "agent",
    "display_name": "Auth Refactor Agent",
    "capabilities": ["refactor", "tests"]
  },
  "base_state": {
    "type": "git",
    "ref": "b7c1f5a2"
  },
  "change_set": {
    "uri": "https://example.com/artifacts/patches/I-2025-0001.patch",
    "media_type": "text/x-diff",
    "digest": { "algo": "sha256", "hash": "d2d2d2d2d2d2d2d2d2d2d2d2d2d2d2d2d2d2d2d2d2d2d2d2d2d2d2d2d2d2d2d2" }
  },
  "summary": "Extract refresh-token flow into auth module",
  "description": "Introduce refresh token handler and update auth routing without changing public API.",
  "scope": {
    "paths": ["auth/"],
    "modules": ["auth"],
    "interfaces": ["AuthAPI:v2"]
  },
  "expected_properties": ["no behavior change", "latency unchanged"],
  "constraints": ["C-SEC-001", "C-ARCH-004"],
  "risk_tags": ["security", "backward-compat"],
  "created_at": "2025-01-15T12:30:00Z",
  "labels": {
    "priority": "high"
  }
}
